{
  "version": 1,
  "track": "sr",
  "budget_ms": 1.5,
  "quality_baseline_db": 38.666,
  "entries": [
    {
      "id": "gen0_baseline",
      "generation": 0,
      "track": "sr",
      "parent_id": null,
      "fingerprint": "8e728462102d85b7",
      "origin": "baseline",
      "notes": "赛道基线模板",
      "report": {
        "candidate_id": "gen0_baseline",
        "status": "PASS",
        "metrics": {
          "operator_latency_ms": 0.26408854,
          "fps_p95_ms": 8.11365,
          "power_watt": 7.203414,
          "psnr_db": 34.52081
        },
        "verdict": {
          "is_pareto_improvement": false,
          "p_value": 0.0011604394453340924
        },
        "source": "phonefarm",
        "quality_reference": {
          "kind": "real_frames",
          "source": "/Users/mac/projects/phonefarm/tasks/genshin_refframes_set",
          "frames": 19,
          "frame_files": [
            "ref_00.png",
            "ref_01.png",
            "ref_02.png",
            "ref_03.png",
            "ref_04.png",
            "ref_05.png",
            "ref_06.png",
            "ref_07.png",
            "ref_08.png",
            "ref_09.png",
            "ref_10.png",
            "ref_11.png",
            "ref_12.png",
            "ref_13.png",
            "ref_14.png",
            "ref_15.png",
            "ref_16.png",
            "ref_17.png",
            "ref_18.png"
          ],
          "candidate_psnr_db": [
            29.6738,
            35.2581,
            33.983,
            34.2695,
            35.1364,
            35.6825,
            35.5388,
            35.2652,
            34.926,
            34.8146,
            34.6463,
            35.2139,
            34.9993,
            34.4378,
            34.6005,
            34.5684,
            34.3167,
            34.3133,
            34.2513
          ],
          "baseline_psnr_db": [
            29.6738,
            35.2581,
            33.983,
            34.2695,
            35.1364,
            35.6825,
            35.5388,
            35.2652,
            34.926,
            34.8146,
            34.6463,
            35.2139,
            34.9993,
            34.4378,
            34.6005,
            34.5684,
            34.3167,
            34.3133,
            34.2513
          ]
        }
      },
      "recorded_at": "2026-09-23T14:40:06.508840+00:00",
      "shader_source": "#version 450\nlayout(local_size_x = 16, local_size_y = 16) in;\n\nlayout(binding = 0, rgba8) uniform readonly image2D u_InputTexture;\nlayout(binding = 1, rgba8) uniform writeonly image2D u_OutputTexture;\n\nvoid main() {\n    ivec2 outPos = ivec2(gl_GlobalInvocationID.xy);\n    ivec2 outSize = imageSize(u_OutputTexture);\n    if (outPos.x >= outSize.x || outPos.y >= outSize.y) return;\n\n    vec2 inCoord = (vec2(outPos) + 0.5) / vec2(outSize);\n    ivec2 inPos = ivec2(inCoord * vec2(imageSize(u_InputTexture)));\n    vec4 color = imageLoad(u_InputTexture, inPos);\n\n    // [LLM 变异插槽: 高频重构与边缘自适应锐化]\n\n    imageStore(u_OutputTexture, outPos, color);\n}\n"
    },
    {
      "id": "gen1_loc1",
      "generation": 1,
      "track": "sr",
      "parent_id": null,
      "fingerprint": "be5819ff5139b052",
      "origin": "local_mutation",
      "notes": "2x2 tap / bilinear / sharpen=0.00 / adaptive / clamped",
      "report": {
        "candidate_id": "gen1_loc1",
        "status": "PASS",
        "metrics": {
          "operator_latency_ms": 0.53044045,
          "fps_p95_ms": 8.341075,
          "power_watt": 7.1994963,
          "psnr_db": 37.79601
        },
        "verdict": {
          "is_pareto_improvement": false,
          "p_value": 0.000030226997276450387
        },
        "source": "phonefarm",
        "quality_reference": {
          "kind": "real_frames",
          "source": "/Users/mac/projects/phonefarm/tasks/genshin_refframes_set",
          "frames": 19,
          "frame_files": [
            "ref_00.png",
            "ref_01.png",
            "ref_02.png",
            "ref_03.png",
            "ref_04.png",
            "ref_05.png",
            "ref_06.png",
            "ref_07.png",
            "ref_08.png",
            "ref_09.png",
            "ref_10.png",
            "ref_11.png",
            "ref_12.png",
            "ref_13.png",
            "ref_14.png",
            "ref_15.png",
            "ref_16.png",
            "ref_17.png",
            "ref_18.png"
          ],
          "candidate_psnr_db": [
            30.0239,
            38.6592,
            36.9625,
            37.3515,
            38.4958,
            39.5052,
            39.0534,
            38.6849,
            38.3331,
            38.2595,
            38.1072,
            38.7812,
            38.4891,
            37.9027,
            38.1435,
            38.0921,
            37.7796,
            37.7774,
            37.7224
          ],
          "baseline_psnr_db": [
            29.6738,
            35.2581,
            33.983,
            34.2695,
            35.1364,
            35.6825,
            35.5388,
            35.2652,
            34.926,
            34.8146,
            34.6463,
            35.2139,
            34.9993,
            34.4378,
            34.6005,
            34.5684,
            34.3167,
            34.3133,
            34.2513
          ]
        }
      },
      "recorded_at": "2026-09-23T14:42:22.884196+00:00",
      "shader_source": "#version 450\nlayout(local_size_x = 16, local_size_y = 16) in;\n\nlayout(binding = 0, rgba8) uniform readonly image2D u_InputTexture;\nlayout(binding = 1, rgba8) uniform writeonly image2D u_OutputTexture;\n\n// 算子族: 2x2 tap / bilinear / sharpen=0.00 / adaptive / clamped\n// 邻域 2x2 = 4 tap; 全部循环静态定界, 零显存往返。\n#define SUPPORT 1.0000\n#define SHARPEN 0.0000\n\nvoid main() {\n    ivec2 outPos = ivec2(gl_GlobalInvocationID.xy);\n    ivec2 outSize = imageSize(u_OutputTexture);\n    if (outPos.x >= outSize.x || outPos.y >= outSize.y) return;\n\n    ivec2 inSize = imageSize(u_InputTexture);\n    // 半像素对齐: 输出像素中心映回输入像素中心。差半像素就是系统性掉 PSNR。\n    vec2 uv = (vec2(outPos) + 0.5) / vec2(outSize) * vec2(inSize) - 0.5;\n    ivec2 base = ivec2(floor(uv));\n    vec2 frac = uv - vec2(base);\n\n    vec4 acc = vec4(0.0);\n    float wsum = 0.0;\n    vec4 nmin = vec4(1.0);\n    vec4 nmax = vec4(0.0);\n\n    for (int dy = 0; dy <= 1; dy++) {\n        for (int dx = 0; dx <= 1; dx++) {\n            ivec2 q = clamp(base + ivec2(dx, dy), ivec2(0), inSize - ivec2(1));\n            vec4 s = imageLoad(u_InputTexture, q);\n            vec2 d = vec2(float(dx), float(dy)) - frac;\n        float w = max(0.0, 1.0 - abs(d.x)) * max(0.0, 1.0 - abs(d.y));\n            acc += s * w;\n            wsum += w;\n        nmin = min(nmin, s);\n        nmax = max(nmax, s);\n        }\n    }\n\n    vec4 col = acc / max(wsum, 1e-5);\n    // 邻域包络夹紧: 负瓣核与锐化都会过冲, 夹回去才不产生振铃亮边。\n    col = clamp(col, nmin, nmax);\n    imageStore(u_OutputTexture, outPos, vec4(clamp(col.rgb, 0.0, 1.0), 1.0));\n}\n"
    },
    {
      "id": "gen1_loc3",
      "generation": 1,
      "track": "sr",
      "parent_id": null,
      "fingerprint": "b0d80e90eeabf92c",
      "origin": "local_mutation",
      "notes": "2x2 tap / bilinear / sharpen=0.00",
      "report": {
        "candidate_id": "gen1_loc3",
        "status": "PASS",
        "metrics": {
          "operator_latency_ms": 0.47899878,
          "fps_p95_ms": 8.2627125,
          "power_watt": 7.202689,
          "psnr_db": 37.79601
        },
        "verdict": {
          "is_pareto_improvement": false,
          "p_value": 0.0002510478666035512
        },
        "source": "phonefarm",
        "quality_reference": {
          "kind": "real_frames",
          "source": "/Users/mac/projects/phonefarm/tasks/genshin_refframes_set",
          "frames": 19,
          "frame_files": [
            "ref_00.png",
            "ref_01.png",
            "ref_02.png",
            "ref_03.png",
            "ref_04.png",
            "ref_05.png",
            "ref_06.png",
            "ref_07.png",
            "ref_08.png",
            "ref_09.png",
            "ref_10.png",
            "ref_11.png",
            "ref_12.png",
            "ref_13.png",
            "ref_14.png",
            "ref_15.png",
            "ref_16.png",
            "ref_17.png",
            "ref_18.png"
          ],
          "candidate_psnr_db": [
            30.0239,
            38.6592,
            36.9625,
            37.3515,
            38.4958,
            39.5052,
            39.0534,
            38.6849,
            38.3331,
            38.2595,
            38.1072,
            38.7812,
            38.4891,
            37.9027,
            38.1435,
            38.0921,
            37.7796,
            37.7774,
            37.7224
          ],
          "baseline_psnr_db": [
            29.6738,
            35.2581,
            33.983,
            34.2695,
            35.1364,
            35.6825,
            35.5388,
            35.2652,
            34.926,
            34.8146,
            34.6463,
            35.2139,
            34.9993,
            34.4378,
            34.6005,
            34.5684,
            34.3167,
            34.3133,
            34.2513
          ]
        }
      },
      "recorded_at": "2026-09-23T14:44:33.088822+00:00",